6688,1,"6688-1-POLO MANGA LARGA","SITARA","POLO MANGA LARGA","Camiseta-","""CAMISETA MODELO PERCHADA M/L CON RIB TIPO POLO  BLANCO.SIN LOGO  CON BORDADO DE FECHA LADO DELANTERO  DERECHO   FECHA. 01-2026 (FECHA AZUL REY)""- ""CAMIBUZOOPERATIVO blancocuello sport conescote redondo en ribmanga corta conpuño en rib ruedo liso""","BLANCO",41,41,0,25311.0,1037751.0,"Pte Aprobación Comercial","26/03/2026 23:38","28/04/2026","104166 FT. BUSO MANGA LARGA PERCHADO BLANCO BARANCA SITARA.pdf","false","82419798","false",82418975,"COS-0012865-2"
6688,2,"6688-2-HODDIE CERRADO","SITARA","HODDIE CERRADO","Buzo-","""BUSO TERMICO M/L CON CAPUCHA EN PERCHADO BLANCO.                                                                                                                                                                                                                                                                                                                                                                                                                                                  SIN LOGO CON BORDADO DE FECHA LADO DELANTERO  DERECHO   FECHA. 01-2026 (FECHA AZUL REY)""""BUZO HOODIEOPERATIVO Colorblanco. Tela SuperFleece. Capota no tan resortada  fija alcuello. Manga largacon puño resortado.Ruedo liso.""","BLANCO",34,34,0,27855.0,947070.0,"Pte Aprobación Comercial","26/03/2026 23:38","28/04/2026","104156 FT. BUSO MANGA LARGA FLEECE BLANCO HOMBRE BARRANCA SITARA.pdf","false","82419825","false",82418981,"COS-0012865-3"
6688,3,"6688-3-PANTALON RESORTADO CABALLERO","SITARA","PANTALON RESORTADO CABALLERO","Pantalon-","PANTALON CABALLERO SEMICLASICO EN DRIL. BLANCO                                   SIN LOGO CON BORDADO DE   FECHA LADO DELANTERO  DERECHO   FECHA. 01-2026 (FECHA AZUL REY) ""PANTALONOPERATIVO DRILCORDOVA Pretinaresortada""","BLANCO",64,64,0,31017.0,1985088.0,"Pte Aprobación Comercial","26/03/2026 23:38","28/04/2026","108150 FT. PANTALÓN DRIL BLANCO HOMBRE BARRANCA SITARA.pdf","false","82419853","false",82418987,"COS-0012865-4"
6688,4,"6688-4-Cofia","SITARA","Cofia","Gorro-","COFIA TIPO SCAFANDRAblancatiras en la misma telamarcación estampada en posterior segúnperiodo de dotación","BLANCO",100,100,0,8203.0,820300.0,"Pte Aprobación Comercial","26/03/2026 23:38","28/04/2026","313072 FT. GORRO ESCAFANDRA BLANCO UNISEX SITARA.pdf","false","82419881","false",82418994,"COS-0012865-5"
6687,1,"6687-1-CAMISA MANGA LARGA","MOLT","CAMISA MANGA LARGA","Camisa-","CAMISA MANGA LARGA, CUELLO CAMISERO, PECHERA CON BOTONES, CLASICADE CABALLERO GORGONA LICRA DE LAFAYETTE COLOR BLANCO 2 LOGOSBORDADOS. TAMAÑO BOLSILLO","BLANCO",17,17,0,82391.0,1400647.0,"Pendiente Inicio Producción","26/03/2026 16:36","08/04/2026","102244 FT. CAMISA MANGA LARGA UN BORDADO POSITIVA (1).pdf","false","82401484","false",81201888,"COS-0012717-1"
6687,2,"6687-2-Blusa","MOLT","Blusa","Camiseta-","BLUSA ADMINISTRATIVA MANGA LARGA-CUELLO NERU-BANDA Y CARTERAINTERNA EN CONTRASTE BASE GORGONA LYCRA BLANCA DE LAFAYETTECONTRASTE INTERNO EN PARKER COLOR NARAN JA Z LOGOS BORDADOSTAMANO BOLSELO","BLANCO",47,47,0,76419.0,3591693.0,"Pendiente Inicio Producción","26/03/2026 16:36","08/04/2026","202259 FT. BLUSA MANGA LARGA UN BORDADO POSITIVA (1).pdf","false","82401518","false",81205718,"COS-0012717-11"
6686,1,"6686-1-CAMISA MANGA LARGA","OMNITEMPUS","CAMISA MANGA LARGA","Camisa-","CAMISA OXFORD MATERNA DAMA  SIN LOGO","AZUL",4,4,0,39641.0,158564.0,"Pendiente Inicio Producción","26/03/2026 16:11","08/04/2026","202256 FT. BLUSA MANGA LARGA MATERNA OXFORD AZUL SIN LOGO OMNITEMPUS (1).pdf","false","82400717","false",82397121,"COS-0012861-55"
6685,1,"6685-1-CAMISA MANGA LARGA","PUNTO DE PAGO 1","CAMISA MANGA LARGA","Camisa-","CAMISA HOMBREcolor  azulCamisa con cuello camisero, pie de cuello interno en color azul oscuro.Cuenta con pechera de asegurar con botones, manga larga con puño y botón.Espalda con almilla.Logo bordado en el pecho.","Azul claro",1,1,0,44130.0,44130.0,"Muestra No Facturable","26/03/2026 14:33","31/12/1969","","true","82393550","false",82389886,"COS-0012855-2"
6685,2,"6685-2-CAMISA MANGA LARGA","PUNTO DE PAGO 1","CAMISA MANGA LARGA","Camisa-","CAMISA DAMAazulCamisa con cuello camisero, pie de cuello interno en color azul oscuro.Cuenta con pechera de asegurar con botones, manga larga con puño y botón.Espalda con almilla.pinzas delanteras y  posteriores de entalle Logo bordado en el pecho.","Azul claro",1,1,0,41718.0,41718.0,"Muestra No Facturable","26/03/2026 14:33","31/12/1969","","true","82393590","false",82391919,"COS-0012855-16"
6685,3,"6685-3-PANTALÓN TIPO CALLE CABALLERO","PUNTO DE PAGO 1","PANTALÓN TIPO CALLE CABALLERO","Pantalon-","PANTALÓN ADMINISTRATIVO HOMBREPantalón con pretina convencional, pasadores y botón.Bragueta con cremallera.Cuenta con bolsillos delanteros diagonales funcionales y bolsillos posteriores de ribete con una pestaña.Bota recta.No lleva logo.","Azul oscuro",1,1,0,75184.0,75184.0,"Muestra No Facturable","26/03/2026 14:33","31/12/1969","","true","82393618","false",82392097,"COS-0012855-3"
6685,4,"6685-4-PANTALÓN  CALLE  DAMA","PUNTO DE PAGO 1","PANTALÓN  CALLE  DAMA","Pantalon-","PANTALÓN ADMINISTRATIVO DAMA Pantalón con pretina convencional, pasadores y botón.Bragueta con cremallera. tiro alto segun imagen de referncia Cuenta con bolsillos delanteros diagonales deimitacion y bolsillos posteriores de ribete con una pestaña.Bota recta. no tan  pitillo No lleva logo.","Azul oscuro",1,1,0,73418.0,73418.0,"Muestra No Facturable","26/03/2026 14:33","31/12/1969","WhatsApp Image 2026-03-26 at 10.07.33 AM.jpeg","true","82393658","false",82392263,"COS-0012855-6"
6685,5,"6685-5-CHAQUETA MICHELIN","PUNTO DE PAGO 1","CHAQUETA MICHELIN","Chaqueta-","CHAQUETA MICHELIN  DAMAcolor negro con cuello alto tipo sport y cremallera central. bolsillos laterales con cremallera. ala  vista Manga larga con puño terminado en sesgo lycrado y ruedo liso con sesgo lycrado. costuras tipo Michelin de 6 cm, dispuestas en sentido horizontal. forro interno liso con guata calibre 200.Logos bordados.","NEGRO",1,1,0,85259.0,85259.0,"Muestra No Facturable","26/03/2026 14:33","31/12/1969","WhatsApp Image 2026-03-26 at 9.52.37 AM (1).jpeg","true","82393687","false",82392115,"COS-0012855-5"
6685,6,"6685-6-POLO MANGA CORTA","PUNTO DE PAGO 1","POLO MANGA CORTA","Camiseta-","CAMISETA POLO MANGA CORTACamiseta tipo polo con cuello y puños tejidos unicolor.Manga corta.Ruedo liso, sin telovid.Logo bordado en el pecho.","Diseño Especial",1,1,0,28994.0,28994.0,"Muestra No Facturable","26/03/2026 14:33","31/12/1969","","true","82393766","false",82392866,"COS-0012855-6"
6684,1,"6684-1-Camibuso Polo Manga Larga","AECSA","Camibuso Polo Manga Larga","Camibuzo-","CAMIBUSO  MANTENIMIENTOgriscuello y puño tejidos  manga larga pechera con botones , ruedo lisologo bordado en pecho mas mantenimiento","Gris",10,10,0,30426.0,304260.0,"Pte Aprobación Comercial","26/03/2026 10:16","04/05/2026","","false","82382179","false",82378772,"COS-0012852-2"
6684,2,"6684-2-Camibuso Polo Manga Larga","AECSA","Camibuso Polo Manga Larga","Camibuzo-","CAMIBUSO COORDINADOR MANTENIMIENTOgriscuello y puño tejidos  manga larga pechera con botones , ruedo lisologo bordado en pecho mas  coordinador mantenimiento","Gris",3,3,0,33410.0,100230.0,"Pte Aprobación Comercial","26/03/2026 10:16","04/05/2026","","false","82382208","false",82378785,"COS-0012852-3"
6684,3,"6684-3-Camibuso Polo Manga Larga","AECSA","Camibuso Polo Manga Larga","Camibuzo-","CAMIBUSO COORDINADOR MANTENIMIENTOnegrocuello y puño tejidos  manga larga pechera con botones , ruedo lisologo bordado en pecho mas  coordinador mantenimiento","NEGRO",4,4,0,33410.0,133640.0,"Pte Aprobación Comercial","26/03/2026 10:16","04/05/2026","","false","82382243","false",82378798,"COS-0012852-4"
6684,4,"6684-4-CHALECO PERIODISTA","AECSA","CHALECO PERIODISTA","Chaleco-","MANTENIMIENTO Dril color grisChaleco tipo periodista Escote en ""V""Cierre: Cremallera centralBolsillos:Delanteros superiores e inferiores tipo parche, con tapa y fuelle para mayor amplitudCogotera para marquillaLogo bordado en el pecho superior izquierdo, sobre el bolsilloLogo bordado en la espalda, ubicado en el centro","Gris",10,10,0,38202.0,382020.0,"Pte Aprobación Comercial","26/03/2026 10:16","04/05/2026","","false","82382360","false",82378814,"COS-0012852-5"
6684,5,"6684-5-PANTALÓN JEAN","AECSA","PANTALÓN JEAN","Pantalon-","JEAN HOMBRE MANTENIMIENTO  Clásico de cinco bolsillosColor: Azul oscuro industrial","AZUL",22,22,0,30943.0,680746.0,"Pte Aprobación Comercial","26/03/2026 10:16","04/05/2026","","false","82382392","false",82378826,"COS-0012852-6"
6684,6,"6684-6-pantalón  overol","AECSA","pantalón  overol","Pantalon-","PANTALON DRIL  HOMBRE  MANTENIMIENTOdril color negro pretina convencional con pasadores y boton bragueta con cremallera , bolsilos diagonales  funcionales tipo parche  , posterior con  bolsillos , tipo ribete o parche segun diseño","NEGRO",4,4,0,42857.0,171428.0,"Pte Aprobación Comercial","26/03/2026 10:16","04/05/2026","","false","82382436","false",82378842,"COS-0012852-7"
6683,1,"6683-1-CONJUNTO ANTIFLUIDO","AECSA","CONJUNTO ANTIFLUIDO","Conjunto-","CONJUNTO SERVICIOS  GENERALES  DAMA color negro Camisa cuello sport tipo bebé, con embone en color contraste.con  escote  en v con embone Manga corta con embone en color contraste.Cortes tipo francés en el delantero y la espalda.Bolsillos frontales con boca de bolsillo y embone decorativo.Cremallera lateral en el costado derecho.Telovid en ambos costados como detalle adicional.Pantalón con pretina resortada, sin bolsillos.","Negro",128,128,0,49037.0,6276736.0,"Pte Aprobación Comercial","26/03/2026 9:32","04/05/2026","","false","82378515","false",82375337,"COS-0012850-2"
6683,2,"6683-2-CONJUNTO ANTIFLUIDO","AECSA","CONJUNTO ANTIFLUIDO","Conjunto-","CONJUNTO SERVICIOS  GENERALES  DAMA color gris Camisa cuello sport tipo bebé, con embone en color contraste.con  escote  en v con embone Manga corta con embone en color contraste.Cortes tipo francés en el delantero y la espalda.Bolsillos frontales con boca de bolsillo y embone decorativo.Cremallera lateral en el costado derecho.Telovid en ambos costados como detalle adicional.Pantalón con pretina resortada, sin bolsillos.","Gris",88,88,0,49037.0,4315256.0,"Pte Aprobación Comercial","26/03/2026 9:32","04/05/2026","","false","82378551","false",82375346,"COS-0012850-3"
6683,3,"6683-3-CONJUNTO ANTIFLUIDO","AECSA","CONJUNTO ANTIFLUIDO","Conjunto-","CONJUNTO SERVICIOS  GENERALES  HOMBREcolor negro Camisa tipo sport con cuello clásico y embone en color contraste.Pechera con botones hasta la mitad del pecho.Manga corta con embone en color contraste.Bolsillos frontales tipo parche con detalle en telovid.Logo bordado en el delantero.Pantalón con pretina resortada, sin bolsillos, y bota recta.","NEGRO",26,26,0,47809.0,1243034.0,"Pte Aprobación Comercial","26/03/2026 9:32","04/05/2026","","false","82378579","false",82375356,"COS-0012850-4"
6683,4,"6683-4-CONJUNTO ANTIFLUIDO","AECSA","CONJUNTO ANTIFLUIDO","Conjunto-","CONJUNTO SERVICIOS  GENERALES  HOMBREcolor gris Camisa tipo sport con cuello clásico y embone en color contraste.Pechera con botones hasta la mitad del pecho.Manga corta con embone en color contraste.Bolsillos frontales tipo parche con detalle en telovid.Logo bordado en el delantero.Pantalón con pretina resortada, sin bolsillos, y bota recta.","Gris",18,18,0,54487.0,980766.0,"Pte Aprobación Comercial","26/03/2026 9:32","04/05/2026","","false","82378608","false",82375364,"COS-0012850-5"
6683,5,"6683-5-DELANTAL TIPO PETO","AECSA","DELANTAL TIPO PETO","Delantal-","DELANTAL SERVICIOS GENERALES - ANTIFLUIDOmaterial : AntifluidoTiras: En la misma tela, con trabilla para graduarBolsillo: De parche en la parte frontalIdentificación: No lleva logo","BLANCO",100,100,0,12724.0,1272400.0,"Pte Aprobación Comercial","26/03/2026 9:32","04/05/2026","","false","82378685","false",82375374,"COS-0012850-6"
6683,6,"6683-6-DELANTAL MICO","AECSA","DELANTAL MICO","Delantal-","DELANTAL TIPO MICO SERVICIOS GENERALES - ANTIFLUIDOmaterial : AntifluidoTiras: En la misma tela, para amarrar en cintura Bolsillo: De parche en la parte frontalIdentificación: No lleva logo","BLANCO",100,100,0,10153.0,1015300.0,"Pte Aprobación Comercial","26/03/2026 9:32","04/05/2026","","false","82378762","false",82375381,"COS-0012850-7"
6683,7,"6683-7-Cofia","AECSA","Cofia","Gorro-","BADANA SERVICIOS   GENERALES  - ANTIFLUIDOGorro  tipo  pirata Material  antifluido  con tiras en la misma tela , no lleva logo","BLANCO",50,50,0,5791.0,289550.0,"Pte Aprobación Comercial","26/03/2026 9:32","04/05/2026","","false","82378808","false",82375385,"COS-0012850-8"
6682,1,"6682-1-CORBATA ADMINISTRATIVA","TALMA COLOMBIA","CORBATA ADMINISTRATIVA","Accesorios-","CORBATA AZUL TALMA","Azul oscuro",100,100,0,26819.0,2681900.0,"Pendiente Inicio Producción","25/03/2026 15:27","14/04/2026","","false","82344783","false",82332418,"COS-0012837-1"
6682,2,"6682-2-Pañoleta","TALMA COLOMBIA","Pañoleta","Accesorios-","PASHMINA-  LATAM","Diseño Especial",120,120,0,44963.0,5395560.0,"Pendiente Inicio Producción","25/03/2026 15:27","14/04/2026","","false","82344859","false",82332427,"COS-0012837-2"
6682,3,"6682-3-Canguro","TALMA COLOMBIA","Canguro","Accesorios-","CANGURERA SAI - LASA PEQUEÑO","AZUL",1200,1200,0,31557.0,3.78684E7,"Pendiente Inicio Producción","25/03/2026 15:27","14/04/2026","","false","82344902","false",82332791,"COS-0012837-3"
6682,4,"6682-4-Pañoleta","TALMA COLOMBIA","Pañoleta","Accesorios-","PASHMINA - JETSMART","AZUL",300,300,0,44750.0,1.3425E7,"Pendiente Inicio Producción","25/03/2026 15:27","14/04/2026","","false","82344996","false",82338137,"COS-0012837-4"
6682,5,"6682-5-CORBATA ADMINISTRATIVA","TALMA COLOMBIA","CORBATA ADMINISTRATIVA","Accesorios-","CORBATA - JETSMART","azul",40,40,0,26866.0,1074640.0,"Pendiente Inicio Producción","25/03/2026 15:27","14/04/2026","","false","82345247","false",82338580,"COS-0012837-5"
6682,6,"6682-6-Camibuzo","TALMA COLOMBIA","Camibuzo","Camibuzo-","CAMIBUSO TIPO POLO NARANJA REFLECTIVO DISEÑOR #2 AVIANCA","Verde",107,107,0,67581.0,7231167.0,"Pendiente Inicio Producción","25/03/2026 15:27","14/04/2026","103269 FT. POLO MANGA LARGA NARANJA SUBLIMADO NEGRO TALMA HOMBRE_compressed.pdf","false","82345286","false",82339593,"COS-0011885-30"
6682,7,"6682-7-Porta Carné","TALMA COLOMBIA","Porta Carné","Accesorios-","CINTA+PORTACARNET TM","Transparente",1330,1330,0,6769.0,9002770.0,"Pendiente Inicio Producción","25/03/2026 15:27","14/04/2026","","false","82345335","false",82340217,"COS-0012837-31"
6681,1,"6681-1-PANTALÓN TIPO CALLE CABALLERO","Asitex","PANTALÓN TIPO CALLE CABALLERO","Pantalon-","Pantalón tipo calle, tiro clásico, bota recta, bolsillos delanteros sesgados funcionales, pretinaconvencional con pasadores y boton ,","Beige",5653,5653,0,26790.0,1.5144387E8,"En Producción","25/03/2026 13:12","14/04/2026","108158 FT. PANTALON CABALLERO CLASICO TIPO CALLE DRIL ASITEX.pdf","false","82339130","false",82337803,"COS-0012842-2"
6681,2,"6681-2-PANTALÓN  CALLE  DAMA","Asitex","PANTALÓN  CALLE  DAMA","Pantalon-","Pantalón tipo calle, tiro clásico, bota recta, bolsillos delanteros sesgados funcionales, pretinaconvencional con pasadores y boton ,","Beige",6149,6149,0,26790.0,1.6473171E8,"En Producción","25/03/2026 13:12","14/04/2026","208161 FT. PANTALON DAMA DRIL ASITEX.pdf","false","82339182","false",82337867,"COS-0012842-2"
6680,1,"6680-1-BATA TIPO LABORATORIO","GRUPO NUTRESA","BATA TIPO LABORATORIO","Bata-","BATA TIPO LABORATORIO BLANCA CON CREMALLERA , MANGA CORTA, APERTURA EN LA PARTE INFERIOR DEL RUEDO TRASERO.Dacron 80% Pol -20% Alg - Color Blanco","Blanco",1,1,0,32595.0,32595.0,"Muestra No Facturable","25/03/2026 11:59","31/12/1969","","true","82337212","false",82336982,"COS-0012839-2"
6679,1,"6679-1-Camibuso Polo Manga Larga","Molt Panamá (PA)","Camibuso Polo Manga Larga","Camibuzo-","Camiseta polo manga larga en tela REAL MADRID - cuello y puños tejidos en azul oscuro -  cinta reflectiva 3M de calor en hombros y espalda, doble en brazos y contorno del pecho - bolsillo en pecho derecho (estampado en bolsillo y espalda alta). Estampado en DTF en bolsillo y en espalda alta.","",1,1,0,110506.0,110506.0,"Pendiente Inicio Producción","24/03/2026 12:40","31/12/1969","","true","82249203","false",82248578,"COS-0012829-2"
6678,1,"6678-1-Zapato Cuero Femenino","Clínica  Palermo","Zapato Cuero Femenino","Zapatos-","Calzado  blanco   Dama   Ref  110","BLANCO",240,240,0,67144.0,1.611456E7,"En Producción","19/03/2026 14:15","27/04/2026","","false","82017618","false",82013449,"COS-0012814-2"
6678,2,"6678-2-Zapato Cuero Masculino","Clínica  Palermo","Zapato Cuero Masculino","Zapatos-","Calzado  blanco  Caballero  Ref  013","BLANCO",70,70,0,69978.0,4898460.0,"En Producción","19/03/2026 14:15","27/04/2026","","false","82017657","false",82013453,"COS-0012814-3"
6678,3,"6678-3-Tennis","Clínica  Palermo","Tennis","Zapatos-","Tenis unisexo     Color Azul suela negra   Ref  585","AZUL",180,180,0,57552.0,1.035936E7,"En Producción","19/03/2026 14:15","27/04/2026","","false","82017696","false",82013455,"COS-0012814-4"
6678,4,"6678-4-Zapato Cuero Masculino","Clínica  Palermo","Zapato Cuero Masculino","Zapatos-","Cuero negro Caballero     Administrativo) Ref  063","NEGRO",25,25,0,82273.0,2056825.0,"En Producción","19/03/2026 14:15","27/04/2026","","false","82017731","false",82013458,"COS-0012814-5"
6678,5,"6678-5-Crocs","Clínica  Palermo","REATA","Accesorios-","Calzado Unisex Ref 599   Sueco color negro","Negro",12,12,0,40167.0,482004.0,"En Producción","19/03/2026 14:15","27/04/2026","","false","82017761","false",82013460,"COS-0012814-6"
6678,6,"6678-6-Crocs","Clínica  Palermo","REATA","Accesorios-","Calzado Unisex Ref  599  Sueco color  blanco","BLANCO",30,30,0,40167.0,1205010.0,"En Producción","19/03/2026 14:15","27/04/2026","","false","82017799","false",82013462,"COS-0012814-7"
6678,7,"6678-7-Zapato Cuero Femenino","Clínica  Palermo","Zapato Cuero Femenino","Zapatos-","Cuero negro   dama Ref   110","NEGRO",90,90,0,67144.0,6042960.0,"En Producción","19/03/2026 14:15","27/04/2026","","false","82017831","false",82013465,"COS-0012814-8"
6678,8,"6678-8-Bota Puntera","Clínica  Palermo","Bota Puntera","Zapatos-","Bota - BOG 03 Puntera (Mantenimiento)","NEGRO",10,10,0,69542.0,695420.0,"En Producción","19/03/2026 14:15","27/04/2026","","false","82017878","false",82013467,"COS-0012814-9"
6677,1,"6677-1-CHAQUETA BOMBER","BOLD","CHAQUETA BOMBER","Chaqueta-","Chaqueta tipo bomber en azul oscuroreferencia  Hombre Cuello: tipo Neru, tejido en ribMangas: larga con puños en ribPretina: tejida en ribCierre: cremallera central con diente metálicoBolsillos: de ribete con cremallera de nylonForro interno: perchado en pecho y espalda; mangas forradas en tela Bryoni lisalogo bordado en el pecho superior izquierdo bordado en espalda  superior ala altura del cuello","Azul oscuro",3,3,0,91245.0,273735.0,"En Producción","19/03/2026 12:51","01/04/2026","106189 FT. CHAQUETA BOMBER AZUL OSCURO HOMBRE BOLD.pdf","false","82012942","false",82012396,"COS-0012813-2"
6677,2,"6677-2-CHAQUETA BOMBER","BOLD","CHAQUETA BOMBER","Chaqueta-","Chaqueta tipo bomber en azul oscuroreferencia Dama Cuello: tipo Neru, tejido en ribMangas: larga con puños en ribPretina: tejida en ribCierre: cremallera central con diente metálicoBolsillos: de ribete con cremallera de nylonForro interno: perchado en pecho y espalda; mangas forradas en tela Bryoni lisalogo bordado en el pecho superior izquierdo bordado en espalda  superior ala altura del cuello","Azul oscuro",3,3,0,91245.0,273735.0,"En Producción","19/03/2026 12:51","01/04/2026","206114 FT. CHAQUETA BOMBER AZUL OSCURO DAMA BOLD.pdf","false","82013019","false",82012407,"COS-0012813-3"
6676,1,"6676-1-Camibuso Polo Manga Larga","SERVILIMA S A S","Camibuso Polo Manga Larga","Camibuzo-","Camibuso polo azul oscuro  manga larga logo  bordado","Azul oscuro",90,90,0,29202.0,2628180.0,"En Producción","19/03/2026 12:18","21/04/2026","103302 FT_ POLO MANGA LARGA AZUL OSCURA SERVILIMA.pdf","false","82012029","false",82008127,"COS-0012810-2"
6676,2,"6676-2-PANTALÓN JEAN","SERVILIMA S A S","PANTALÓN JEAN","Pantalon-","Jean operativo  hombre azul  no lleva logo","AZUL",43,43,0,31521.0,1355403.0,"En Producción","19/03/2026 12:18","21/04/2026","108160 FT_ JEANS AZUL OPERATIVO HOMBRE SERVILIMA.pdf","false","82012060","false",82008188,"COS-0012810-3"
6675,1,"6675-1-Reata","Yunex","Reata","Accesorios-","HOMBREREATA  NEGRA 100% ALGODON DIELECTRICA  CON HEBILLA DE CHAPA PLASTICA-RELIZARLA SEGUN MEDIDAS  INDICADAS","NEGRO",184,184,0,14988.0,2757792.0,"En Producción","19/03/2026 8:43","27/04/2026","","false","81999559","false",81997754,"COS-0012807-2"
6675,2,"6675-2-Reata","Yunex","Reata","Accesorios-","DAMAREATA  NEGRA 100% ALGODON DIELECTRICA  CON HEBILLA DE CHAPA PLASTICA-RELIZARLA SEGUN MEDIDAS  INDICADAS","NEGRO",8,8,0,14988.0,119904.0,"En Producción","19/03/2026 8:43","27/04/2026","","false","81999596","false",81998911,"COS-0012807-3"
6675,3,"6675-3-Toalla","Yunex","Toalla","Accesorios-","UNISEXTOALLA DE MANOS EN 100% ALGODN DIMENSIONES  40X70 COLOR  NEGRO O GRIS","Negro",200,200,0,18054.0,3610800.0,"En Producción","19/03/2026 8:43","27/04/2026","","false","81999637","false",81997853,"COS-0012807-3"
6674,1,"6674-1-Chaqueta Sport","MOLT","Chaqueta Sport","Chaqueta-","ZEUUS  HOMBRE Chaqueta sport Azul  rey  con rojo Color azul rey con forro interno en tono contraste. rojo Capota fija con tanca y cordón elástico para graduar.Cremallera central.Bolsillos delanteros con cremallera a la vista en color contraste Bolsillo superior derecho con cremallera a la vista y embone reflectivo. en contorno del bolsilloManga larga con puño resortado.Ruedo liso.Forro interno liso con proceso de laminado.Logos estampados en vinilo reflectivo en pecho y espalda.","Azúl Rey",2,2,0,101073.0,202146.0,"Rechazado Perdida para Molt","19/03/2026 7:50","07/04/2026","AF Chaquetas ZEUSS - ESTINSA.pdf","false","81995319","false",81945596,"COS-0012803-2"
6674,2,"6674-2-CHAQUETA SPORT","MOLT","CHAQUETA SPORT","Chaqueta-","ZEUUS  STINSA HOMBRE Chaqueta sport Azul  rey  con rojo Color azul rey con forro interno en tono contraste. rojo Capota fija con tanca y cordón elástico para graduar.Cremallera central.Bolsillos delanteros con cremallera a la vista en color contraste Bolsillo superior derecho con cremallera a la vista y embone reflectivo. en contorno del bolsilloManga larga con puño resortado.Ruedo liso.Forro interno liso con proceso de laminado.Logos estampados en vinilo reflectivo en pecho y espalda.","Azúl Rey",1,1,0,101073.0,101073.0,"Rechazado Perdida para Molt","19/03/2026 7:50","07/04/2026","MUESTRA DIGITAL Chaquetas ZEUSS - ESTINSA.jpg","false","81995435","false",81945626,"COS-0012803-4"
6674,3,"6674-3-CHAQUETA SPORT","MOLT","CHAQUETA SPORT","Chaqueta-","ZEUUS  STINSA DAMAChaqueta sport Azul  rey con rojoColor azul rey con forro interno en tono contraste. rojo Capota fija con tanca y cordón elástico para graduar.Cremallera central.Bolsillos delanteros con cremallera a la vista en color contraste Bolsillo superior derecho con cremallera a la vista y embone reflectivo. en contorno del bolsilloManga larga con puño resortado.Ruedo liso.Forro interno liso con proceso de laminado.Logos estampados en vinilo reflectivo en pecho y espalda.","Azúl Rey",1,1,0,101073.0,101073.0,"Rechazado Perdida para Molt","19/03/2026 7:50","07/04/2026","MUESTRA DIGITAL Chaquetas ZEUSS - ESTINSA.jpg","false","81995476","false",81945640,"COS-0012803-5"
6674,4,"6674-4-CHAQUETA SPORT","MOLT","CHAQUETA SPORT","Chaqueta-","ZEUUS  ZERHOMBRE Chaqueta sport negra con gris Color azul rey con forro interno en tono contraste. rojo Capota fija con tanca y cordón elástico para graduar.Cremallera central.Bolsillos delanteros con cremallera a la vista en color contraste Bolsillo superior derecho con cremallera a la vista y embone reflectivo. en contorno del bolsilloManga larga con puño resortado.Ruedo liso.Forro interno liso con proceso de laminado.Logos estampados en vinilo reflectivo en pecho y espalda.","NEGRO",2,2,0,101073.0,202146.0,"Rechazado Perdida para Molt","19/03/2026 7:50","07/04/2026","AF Chaqueta ZER.pdf","false","81995546","false",81945656,"COS-0012803-6"
6673,1,"6673-1-POLO MANGA CORTA","NUTRESA","POLO MANGA CORTA","Camiseta-","Camiseta PoloColor: Rojo HOMBRECuello y puños: TejidosManga: CortaRuedo: Lisodos logos bordados feb. 2026","",1,1,0,23019.0,23019.0,"Muestra No Facturable","18/03/2026 16:11","31/12/1969","","true","81948238","false",81946992,"COS-0012804-2"
6673,2,"6673-2-POLO MANGA CORTA","NUTRESA","POLO MANGA CORTA","Camiseta-","Camiseta PoloColor: Rojo DAMACuello y puños: TejidosManga: CortaRuedo: Lisodos logos bordados feb. 2026","",1,1,0,23019.0,23019.0,"Muestra No Facturable","18/03/2026 16:11","31/12/1969","","true","81948425","false",81946893,"COS-0012804-2"
6672,1,"6672-1-Buzo / Cerrado","GRAN AMERICA","Buzo / Cerrado","Buzo-","BUZO gris oscurodamaMaprycomCuello redondoManga larga con puños en ribRuedo o fajón en riblogo estampado en pecho, hiladillo color hueso","Gris",26,26,0,59968.0,1559168.0,"Pendiente Inicio Producción","17/03/2026 18:26","08/05/2026","204046 FT. SACO CUELLO REDONDO GRIS GRAN AMERICA DAMA.pdf","false","81889384","false",81884540,"COS-0012801-2"
